{
  "alertLevel": "info",
  "ambiguousParentRunIds": [],
  "blockingIssueCount": 0,
  "checkSummary": {
    "alertLevel": "info",
    "allPassed": true,
    "dominantSeverity": "info",
    "failed": 0,
    "failingCodes": [],
    "failingNames": [],
    "failingSeverityCounts": {
      "critical": 0,
      "info": 0,
      "warning": 0
    },
    "failureRate": 0.0,
    "hasCriticalFailures": false,
    "hasInfoFailures": false,
    "hasWarningFailures": false,
    "issueCodes": [],
    "passRate": 1.0,
    "passed": 1,
    "primaryFailingAction": "No action required.",
    "primaryFailingCode": "ALKHAWARIZM_LINEAGE_HEALTHY",
    "primaryFailingMessage": "Lineage health checks passed.",
    "primaryFailingName": "none",
    "primaryFailingSeverity": "info",
    "primaryFailingType": "none",
    "primaryIssueCode": "ALKHAWARIZM_LINEAGE_HEALTHY",
    "recommendedAction": "No lineage action required.",
    "severityCounts": {
      "critical": 0,
      "info": 1,
      "warning": 0
    },
    "status": "healthy",
    "summaryMessage": "Lineage health checks passed.",
    "total": 1
  },
  "checks": [
    {
      "action": "No action required.",
      "affectedRunIds": [],
      "blocking": false,
      "code": "ALKHAWARIZM_LINEAGE_DUPLICATE_RUN_ID",
      "count": 0,
      "detail": "Every checkpoint run id is unique.",
      "label": "Unique run ids",
      "name": "uniqueRunIds",
      "passed": true,
      "runIds": [],
      "severity": "info",
      "status": "pass",
      "type": "duplicate-run-id"
    }
  ],
  "cycleRunIds": [],
  "duplicateRunIds": [],
  "failingCheckCount": 0,
  "failingChecks": [],
  "healthBadge": {
    "alertLevel": "info",
    "checkStatus": "pass",
    "label": "Healthy",
    "primaryCheckAction": "No action required.",
    "primaryCheckCode": "ALKHAWARIZM_LINEAGE_HEALTHY",
    "primaryCheckSeverity": "info",
    "primaryCheckType": "none",
    "primaryIssueCode": "ALKHAWARIZM_LINEAGE_HEALTHY",
    "recommendedAction": "No lineage action required.",
    "score": 1.0,
    "status": "healthy",
    "token": "lineage-health-healthy",
    "tooltip": "checkpoint lineage graph healthy",
    "variant": "success"
  },
  "healthScore": 1.0,
  "healthy": true,
  "issueCodes": [],
  "issueCount": 0,
  "issueDetailCount": 0,
  "issueDetails": [],
  "issueTypes": [],
  "kind": "checkpoint-lineage-health",
  "missingParentRunIds": [],
  "parentMismatchRunIds": [],
  "passingCheckCount": 1,
  "recommendedAction": "No lineage action required.",
  "rootDir": "/tmp/alkhawarizm-lineage-healthy",
  "schemaVersion": "alkhawarizm.checkpoint-lineage-health.v1",
  "status": "healthy",
  "summary": "checkpoint lineage graph healthy",
  "summaryMessage": "checkpoint lineage graph healthy",
  "unresolvedRunIds": []
}